{
  "site": {
    "title": "Letter Stories",
    "base_url": "/",
    "favicon": "/images/favicon.png",
    "logo": "/images/logo-dark.png",
    "logo_width": "80",
    "logo_height": "100",
    "logo_text": "Letter Stories"
  },

  "settings": {
    "pagination": 6,
    "summary_length": 200,
    "blog_folder": "posts"
  },

  "params": {
    "tag_manager_id": "",
    "contact_form_action": "#",
    "footer_content": "Lorem ipsum dolor sit sed dmi amet, consectetur adipiscing. Cdo tellus, sed condimentum volutpat.",
    "copyright": "Designed & Developed By Prasad"
  },

  "contact_info": {
    "phone": "<phone>",
    "email": "<email>"
  },

  "nav_button": {
    "enable": true,
    "label": "Shop Now",
    "link": "/shop"
  },

  "metadata": {
    "meta_author": "Prasad Koshy Jose",
    "meta_image": "/images/og-image.png",
    "meta_description": "Letter Stories for Adults and Children sent via post."
  },

  "call_to_action": {
    "enable": true,
    "title": "Get Letter Stories Now",
    "content": "Lorem ipsum dolor sit amet, consectetur adipiscing elit. Morbi egestas </br> Werat viverra id et aliquet. vulputate egestas sollicitudin.",
    "button": {
      "label": "Shope Now",
      "link": "/shop"
    }
  },

  "disqus": {
    "enable": true,
    "shortname": "themefisher-template",
    "settings": {}
  }
}
